{
  "identity": {
    "id": "chillon-castle",
    "name_ja": "シヨン城",
    "name_en": "Chillon Castle",
    "qid": "Q372647",
    "country": "CH",
    "country_ja": "スイス",
    "type": "single_poi",
    "lat": 46.41417,
    "lon": 6.9275,
    "base_place_id": null,
    "endpoints": null,
    "note": "レマン湖畔。最寄り都市はモントルー"
  },
  "geography": {
    "population": null,
    "population_date": null,
    "elevation_m": null,
    "coastal": null,
    "_meta": {
      "source": "wikidata",
      "license": "CC0-1.0",
      "attribution": null,
      "retrieved_at": "2026-07-16"
    }
  },
  "poi": null,
  "osm_features": null,
  "heritage": {
    "whs_onsite": [],
    "whs_within_30km": 2,
    "_meta": {
      "source": "wikidata",
      "license": "CC0-1.0",
      "attribution": null,
      "retrieved_at": "2026-07-16"
    }
  },
  "climate": {
    "monthly": [
      {
        "month": 1,
        "temp_mean_c": 4.8,
        "precip_mm": 207.5,
        "sunshine_h": 149.1,
        "humidity_pct": 87.9
      },
      {
        "month": 2,
        "temp_mean_c": 7.4,
        "precip_mm": 94.4,
        "sunshine_h": 197.1,
        "humidity_pct": 83.9
      },
      {
        "month": 3,
        "temp_mean_c": 8.6,
        "precip_mm": 140.7,
        "sunshine_h": 233.0,
        "humidity_pct": 80.2
      },
      {
        "month": 4,
        "temp_mean_c": 10.5,
        "precip_mm": 185.6,
        "sunshine_h": 271.6,
        "humidity_pct": 76.0
      },
      {
        "month": 5,
        "temp_mean_c": 14.0,
        "precip_mm": 191.4,
        "sunshine_h": 282.2,
        "humidity_pct": 81.3
      },
      {
        "month": 6,
        "temp_mean_c": 18.3,
        "precip_mm": 211.5,
        "sunshine_h": 304.1,
        "humidity_pct": 81.0
      },
      {
        "month": 7,
        "temp_mean_c": 21.5,
        "precip_mm": 137.0,
        "sunshine_h": 367.4,
        "humidity_pct": 80.5
      },
      {
        "month": 8,
        "temp_mean_c": 22.6,
        "precip_mm": 71.3,
        "sunshine_h": 358.3,
        "humidity_pct": 81.7
      },
      {
        "month": 9,
        "temp_mean_c": 15.9,
        "precip_mm": 258.9,
        "sunshine_h": 231.3,
        "humidity_pct": 87.1
      },
      {
        "month": 10,
        "temp_mean_c": 14.3,
        "precip_mm": 180.7,
        "sunshine_h": 230.6,
        "humidity_pct": 88.6
      },
      {
        "month": 11,
        "temp_mean_c": 9.2,
        "precip_mm": 148.3,
        "sunshine_h": 214.0,
        "humidity_pct": 87.8
      },
      {
        "month": 12,
        "temp_mean_c": 5.1,
        "precip_mm": 158.0,
        "sunshine_h": 160.0,
        "humidity_pct": 85.3
      }
    ],
    "reference_period": "2024",
    "_meta": {
      "source": "era5",
      "license": "Copernicus-Products-Licence",
      "attribution": "Generated using Copernicus Climate Change Service information 2026",
      "retrieved_at": "2026-07-16"
    }
  },
  "access": {
    "nearest_airport": {
      "iata": "GVA",
      "name": "Geneva International Airport",
      "type": "large_airport",
      "country": "CH",
      "distance_km": 65.8
    },
    "nearest_large_airport": {
      "iata": "GVA",
      "name": "Geneva International Airport",
      "country": "CH",
      "distance_km": 65.8,
      "type": "large_airport"
    },
    "nearest_hub_place_id": "geneva",
    "nearest_hub_distance_km": 64.3,
    "_meta": {
      "source": "ourairports",
      "license": "Public-Domain",
      "attribution": null,
      "retrieved_at": "2026-07-16"
    }
  },
  "recognition": {
    "wikipedia_views_ja_year": 4577,
    "wikipedia_views_en_year": 52503,
    "wikipedia_sitelinks": 48,
    "views_year": "2025",
    "nights_spent_nuts2": null,
    "_meta": {
      "source": "wikimedia_pageviews",
      "license": "CC0-1.0",
      "attribution": null,
      "retrieved_at": "2026-07-16"
    }
  },
  "safety": null,
  "indicators": {
    "seasonal_comfort": {
      "value": [
        46,
        74,
        70,
        70,
        70,
        70,
        73,
        86,
        69,
        68,
        67,
        48
      ],
      "cohort": null,
      "depends_on": [
        "era5"
      ],
      "formula": "月別: 0.5*快適帯(8-27C台形) + 0.3*(1-降水/150mm) + 0.2*min(日照/250h,1)"
    }
  },
  "meta": {
    "schema_version": "0.2.0-draft",
    "generated_at": "2026-07-16",
    "notes": "フェーズ2設計レビュー用サンプル。poi/osm_features/safetyはフェーズ3で取得（null）。気候は2024年単年の暫定値（本番はERA5平年値に置換）。コホート正規化が必要な指標（food_scene等）は全件データ作成後に算出。"
  }
}